{
  "schema_version":"1.0.0","package_id":"ap-statistics-q1-fixture","content_key":"ap-statistics-q1-fixture","content_version":1,
  "exam_pack_ref":{"exam_code":"AP-STAT","school_year":"2026-27","exam_pack_version":"1.0.0"},
  "item_type":"frq","archetype_ref":{"archetype_key":"frq-practices-1-2","version":"1.0.0"},
  "taxonomy_refs":[{"scheme_key":"ap-statistics-fall-2026","scheme_version":"1.0.0","node_key":"practice-1"},{"scheme_key":"ap-statistics-fall-2026","scheme_version":"1.0.0","node_key":"practice-2"}],
  "stimuli":[{"stimulus_key":"study-context","ordinal":1,"kind":"text","payload":{"text":"A school wants to investigate a student behavior."},"source_refs":["college-board-ap-statistics-ced-fall-2026"]}],
  "parts":[{"part_key":"part-a","ordinal":1,"label":"(a)","prompt":"Formulate an investigative question and describe an appropriate data-collection plan.","stimulus_refs":["study-context"],"response_modalities":["typed-text"],"points":10,"criteria":[{"criterion_key":"question-and-plan","points":10,"description":"Question and collection plan are aligned and justified.","required_evidence":["population","variables","sampling-or-assignment"]}]}],
  "accessibility":{"language":"en-US","screen_reader_review_required":true,"accommodation_notes":"Text-only fixture."},
  "provenance":{"source_refs":["college-board-ap-statistics-ced-fall-2026"],"fact_pack_version":"AP_STATISTICS_2027_CED_FACT_PACK@2026-07-13","authoring_prompt_version":"fixture-v1","generated_by":"Codex fixture","generated_at":"2026-07-13T12:00:00Z","content_sha256":"1111111111111111111111111111111111111111111111111111111111111111"},
  "legacy_projection":{"frq_form":"practices_1_2","projection_only":true}
}
